{"schema_version":1,"authority":{"kind":"host","host_id":"host-4"},"command_id":"cmd-start-02","payload_digest":"aaaaaaaaaaaaaaaaaaaaaaaaaaaaaaaaaaaaaaaaaaaaaaaaaaaaaaaaaaaaaaaa","receipt_state":"effect_resolved","updated_at_unix_ms":1700000000002,"resolution":{"resolution_id":"resolution-9","outcome":"succeeded","result_digest":"cccccccccccccccccccccccccccccccccccccccccccccccccccccccccccccccc"}}
