{
  "schema_version": 1,
  "authority": {
    "kind": "host",
    "host_id": "host-4"
  },
  "command_id": "cmd-start-02",
  "payload_digest": "aaaaaaaaaaaaaaaaaaaaaaaaaaaaaaaaaaaaaaaaaaaaaaaaaaaaaaaaaaaaaaaa",
  "receipt_state": "host_rejected",
  "updated_at_unix_ms": 1700000000004,
  "rejection": {
    "code": "stale_revision"
  }
}
