{"schema_version":1,"authority":{"kind":"host","host_id":"host-4"},"command_id":"cmd-start-02","payload_digest":"aaaaaaaaaaaaaaaaaaaaaaaaaaaaaaaaaaaaaaaaaaaaaaaaaaaaaaaaaaaaaaaa","receipt_state":"outcome_unknown","updated_at_unix_ms":1700000000003,"unknown_reason":"ambiguous_history","reconciliation_required":true}
